,text,verb1,verb2,verb3,verb4,verb5,verb6,time_exp1,time_exp2,time_exp3,time_exp4,time_exp5,tense
190,In general I brush my teeth before I go to bed.,"verb, non-3rd person singular present","verb, non-3rd person singular present",,,,,general,before,,,,present simple
191,In general this is how we do it.,"verb, 3rd person singular present","verb, non-3rd person singular present",,,,,general,this,,,,present simple
192,Generally she sings like this.,"verb, 3rd person singular present",,,,,,Generally,this,,,,present simple
193,Generally I do not afraid dogs.,"verb, non-3rd person singular present",,,,,,Generally,,,,,present simple
194,Generally he do not cry.,"verb, non-3rd person singular present","verb, base form",,,,,Generally,,,,,present simple
195,In generally he stans by her.,"verb, 3rd person singular present",,,,,,generally,by,,,,present simple
196,My love to you is general.,"verb, 3rd person singular present",,,,,,general,,,,,present simple
197,I don’t like the food they serve at that restaurant.,"verb, non-3rd person singular present","verb, non-3rd person singular present",,,,,,,,,,present simple
198,Jim doesn’t work on Fridays.,"verb, 3rd person singular present","verb, base form",,,,,,,,,,present simple
199,My friends don’t usually leave so early.,"verb, non-3rd person singular present","verb, base form",,,,,usually,so,,,,present simple
200,I do not want to go with you!,"verb, non-3rd person singular present","verb, base form","verb, base form",,,,,,,,,present simple
201,He always does good work.,"verb, 3rd person singular present",,,,,,always,,,,,present simple
202,Do you like me?,"verb, non-3rd person singular present","verb, base form",,,,,,,,,,present simple
203,What did they bring you?,"verb, past tense","verb, base form",,,,,,,,,,present simple
204,Do you surf the Internet every day?,"verb, non-3rd person singular present","verb, base form",,,,,every,day,,,,present simple
205,Every day I go to work.,"verb, non-3rd person singular present",,,,,,Every,day,,,,present simple
206,Every day I eat lunch at noon.,"verb, non-3rd person singular present",,,,,,Every,day,,,,present simple
207,Every day I a chapter from my book.,,,,,,,Every,day,,,,present simple
208,Every day I ride my bike to work.,"verb, non-3rd person singular present",,,,,,Every,day,,,,present simple
209,Every night I go to bed early.,"verb, non-3rd person singular present",,,,,,Every,,,,,present simple
210,Every night I brush my teeth before I go to bed.,"verb, non-3rd person singular present","verb, non-3rd person singular present",,,,,Every,before,,,,present simple
211,Every night me and my dauther sing a song.,"verb, non-3rd person singular present",,,,,,Every,,,,,present simple
212,Every monday I work at the shelter.,"verb, non-3rd person singular present",,,,,,Every,,,,,present simple
213,Does Jonathan always turn off the lights?.,"verb, 3rd person singular present","verb, base form",,,,,always,,,,,present simple
214,Don’t you ever clean your room?,"verb, base form","verb, non-3rd person singular present",,,,,ever,,,,,present simple
215,When do you want to meet me?,"verb, non-3rd person singular present","verb, base form","verb, base form",,,,When,,,,,present simple
216,Why does Beth always complain so much?,"verb, 3rd person singular present","verb, base form",,,,,always,so,,,,present simple
217,How much does the ticket cost?,"verb, 3rd person singular present",,,,,,,,,,,present simple
218,Why don’t you ever go on vacation?,"verb, non-3rd person singular present","verb, non-3rd person singular present",,,,,ever,,,,,present simple
219,"John likes me, doesn’t he?","verb, 3rd person singular present","verb, 3rd person singular present",,,,,,,,,,present simple
220,All those girls speak French,"verb, non-3rd person singular present",,,,,,,,,,,present simple
221,We are discussing the project at the moment.,"verb, non-3rd person singular present","verb, gerund or present participle",,,,,moment,,,,,present progressive
222,Jim is leaving for Brussels this evening.,"verb, 3rd person singular present","verb, gerund or present participle",,,,,for,this,evening,,,present progressive
223,Her husband is always complaining about his health.,"verb, 3rd person singular present","verb, gerund or present participle",,,,,always,,,,,present progressive
224,You are not going out tonight!,"verb, non-3rd person singular present","verb, gerund or present participle",,,,,,,,,,present progressive
225,I’m not listening to you.,"verb, non-3rd person singular present","verb, gerund or present participle",,,,,,,,,,present progressive
226,Roger isn’t eating with us tonight.,"verb, 3rd person singular present","verb, gerund or present participle",,,,,,,,,,present progressive
227,The Smiths aren’t going to France this year. They’re going to Thailand.,"verb, non-3rd person singular present","verb, gerund or present participle","verb, non-3rd person singular present","verb, gerund or present participle",,,this,year,,,,present progressive
228,He is not coming with me dressed like that!,"verb, 3rd person singular present","verb, gerund or present participle",,,,,,,,,,present progressive
229,Are you participating in the competition next week?,"verb, non-3rd person singular present","verb, gerund or present participle",,,,,next,week,,,,present progressive
230,Which route are you taking to the conference this week?,"verb, non-3rd person singular present","verb, gerund or present participle",,,,,this,week,,,,present progressive
231,Latika‘s not working at IBM anymore.,"verb, gerund or present participle",,,,,,anymore,,,,,present progressive
232,Joyce isn’t playing in today’s tournament.,"verb, 3rd person singular present","verb, gerund or present participle",,,,,today,,,,,present progressive
233,We are eating with my parents this evening.,"verb, non-3rd person singular present","verb, gerund or present participle",,,,,this,evening,,,,present progressive
234,She is going home this evening.,"verb, 3rd person singular present","verb, gerund or present participle",,,,,this,evening,,,,present progressive
235,She is going home this afternoon.,"verb, 3rd person singular present","verb, gerund or present participle",,,,,this,afternoon,,,,present progressive
236,We are going to see the lions this week.,"verb, non-3rd person singular present","verb, gerund or present participle","verb, base form",,,,this,week,,,,present progressive
237,There is a huge festival in town this week.,"verb, 3rd person singular present",,,,,,this,week,,,,present progressive
238,We will go to a picnic this weekend.,"verb, modal auxiliary","verb, base form",,,,,this,weekend,,,,present progressive
239,I am studying to become a lawyer this year.,"verb, non-3rd person singular present","verb, gerund or present participle","verb, base form",,,,this,year,,,,present progressive
240,I am reading a book right now.,"verb, non-3rd person singular present","verb, gerund or present participle",,,,,right,now,,,,present progressive
241,We are learning English now.,"verb, non-3rd person singular present","verb, gerund or present participle",,,,,now,,,,,present progressive
242,We're watching TV right now.,"verb, non-3rd person singular present","verb, gerund or present participle",,,,,right,now,,,,present progressive
243,At present my father is working abroad.,"verb, 3rd person singular present","verb, gerund or present participle",,,,,present,,,,,present progressive
244,He is presently studying in Istanbul.,"verb, 3rd person singular present","verb, gerund or present participle",,,,,presently,,,,,present progressive
245,We're using my old computer for the time being.,"verb, non-3rd person singular present","verb, gerund or present participle","verb, gerund or present participle",,,,for,time,being,,,present progressive
246,I am reading a book for the time being.,"verb, non-3rd person singular present","verb, gerund or present participle","verb, gerund or present participle",,,,for,time,being,,,present progressive
247,She is working at bank for the time being.,"verb, 3rd person singular present","verb, gerund or present participle","verb, gerund or present participle",,,,for,time,being,,,present progressive
248,He is okay for the time being.,"verb, 3rd person singular present","verb, gerund or present participle",,,,,for,time,being,,,present progressive
249,We are on our way for the time being.,"verb, non-3rd person singular present","verb, gerund or present participle",,,,,for,time,being,,,present progressive
250,The Director is currently having talks in the USA,"verb, 3rd person singular present","verb, gerund or present participle",,,,,currently,,,,,present progressive
251,We are currently on this project.,"verb, non-3rd person singular present",,,,,,currently,this,,,,present progressive
252,We are currently watching a movie.,"verb, non-3rd person singular present","verb, gerund or present participle",,,,,currently,,,,,present progressive
253,We are currently eating a pizza.,"verb, non-3rd person singular present","verb, gerund or present participle",,,,,currently,,,,,present progressive
254,We are currently running a restauran.,"verb, non-3rd person singular present","verb, gerund or present participle",,,,,currently,,,,,present progressive
255,She's not waiting here at the moment.,"verb, 3rd person singular present","verb, gerund or present participle",,,,,moment,,,,,present progressive
256,She is not waiting here at the moment.,"verb, 3rd person singular present","verb, gerund or present participle",,,,,moment,,,,,present progressive
257,Charles is taking three courses this year.,"verb, 3rd person singular present","verb, gerund or present participle",,,,,this,year,,,,present progressive
258,Charles is taking three courses this term.,"verb, 3rd person singular present","verb, gerund or present participle",,,,,this,,,,,present progressive
259,Car prices are getting higher nowadays.,"verb, non-3rd person singular present","verb, gerund or present participle",,,,,nowadays,,,,,present progressive
260,Car prices are getting higher these days.,"verb, non-3rd person singular present","verb, gerund or present participle",,,,,these,days,,,,present progressive
261,I am not going to the party tonight.,"verb, non-3rd person singular present","verb, gerund or present participle",,,,,tonight,,,,,future simple
262,Is he visiting his parents next weekend?,"verb, 3rd person singular present","verb, gerund or present participle",,,,,next,weekend,,,,future simple
263,They are flying to Paris next week.,"verb, non-3rd person singular present","verb, gerund or present participle",,,,,next,week,,,,future simple
264,Tom is staring a new job on Friday.,"verb, 3rd person singular present","verb, gerund or present participle",,,,,,,,,,future simple
265,My dad is retiring in 2032.,"verb, 3rd person singular present","verb, gerund or present participle",,,,,,,,,,future simple
266,My dad is retiring in June.,"verb, 3rd person singular present","verb, gerund or present participle",,,,,,,,,,future simple
267,She is always coming to class late.,"verb, 3rd person singular present","verb, gerund or present participle",,,,,always,,,,,present progressive
268,He is always eating something.,"verb, 3rd person singular present","verb, gerund or present participle",,,,,always,,,,,present progressive
269,He is constantly talking.,"verb, 3rd person singular present","verb, gerund or present participle",,,,,constantly,,,,,present progressive
270,He is constantly working.,"verb, 3rd person singular present","verb, gerund or present participle",,,,,constantly,,,,,present progressive
271,He is constantly looking for something.,"verb, 3rd person singular present","verb, gerund or present participle",,,,,constantly,for,,,,present progressive
272,She is constantly watching TV.,"verb, 3rd person singular present","verb, gerund or present participle",,,,,constantly,,,,,present progressive
273,She is constantly doing the dishes.,"verb, 3rd person singular present","verb, gerund or present participle",,,,,constantly,,,,,present progressive
274,they are always complaining.,"verb, non-3rd person singular present","verb, gerund or present participle",,,,,always,,,,,present progressive
275,He is continuously changing his mind.,"verb, 3rd person singular present","verb, gerund or present participle",,,,,continuously,,,,,present progressive
276,He is continuously teasing her.,"verb, 3rd person singular present","verb, gerund or present participle",,,,,continuously,,,,,present progressive
277,He is continuously poking it.,"verb, 3rd person singular present","verb, gerund or present participle",,,,,continuously,,,,,present progressive
278,He is continuously speaking out loud.,"verb, 3rd person singular present","verb, gerund or present participle",,,,,continuously,,,,,present progressive
279,she is always having arguments with other students.,"verb, 3rd person singular present","verb, gerund or present participle",,,,,always,,,,,present progressive
280,I will see you next Sunday.,"verb, modal auxiliary","verb, base form",,,,,next,,,,,future simple
281,We had a meeting last Thursday.,"verb, past tense",,,,,,last,,,,,past simple
282,Jennifer has her programming course on Wednesday.,"verb, 3rd person singular present",,,,,,,,,,,future simple
283,We have our class on Tuesdays and Thursdays.,"verb, non-3rd person singular present",,,,,,,,,,,present simple
284,I used to play tennis on Saturdays.,"verb, past tense","verb, base form",,,,,,,,,,present simple
285,I play tennis at weekends.,"verb, non-3rd person singular present",,,,,,weekends,,,,,present simple
286,She visits her mother on the weekend.,"verb, 3rd person singular present",,,,,,weekend,,,,,present simple
287,We're going to the beach on the weekend.,"verb, non-3rd person singular present","verb, gerund or present participle",,,,,weekend,,,,,present simple
288,We're going to the beach on the next weekend.,"verb, non-3rd person singular present","verb, gerund or present participle",,,,,next,weekend,,,,present simple
289,They visited Chicago on the weekend.,"verb, past tense",,,,,,weekend,,,,,past simple
290,They do the cleaning in the morning.,"verb, non-3rd person singular present",,,,,,morning,,,,,present simple
291,He goes to bed late at night.,"verb, 3rd person singular present",,,,,,night,,,,,present simple
292,We will do the homework in the evening.,"verb, modal auxiliary","verb, base form",,,,,evening,,,,,future simple
293,She had a drink in the evening.,"verb, past tense",,,,,,evening,,,,,past simple
294,She travels to Las Vegas every year.,"verb, 3rd person singular present",,,,,,every,year,,,,present simple
295,Jack tries to exercise every day.,"verb, 3rd person singular present","verb, base form",,,,,every,day,,,,present simple
296,They sometimes play golf.,"verb, non-3rd person singular present",,,,,,sometimes,,,,,present simple
297,She rarely smokes.,"verb, 3rd person singular present",,,,,,rarely,,,,,present simple
298,Tom is watching TV now.,"verb, 3rd person singular present","verb, gerund or present participle",,,,,now,,,,,present progressive
299,I am working on the Smith project today.,"verb, non-3rd person singular present","verb, gerund or present participle",,,,,today,,,,,present progressive
300,Jane is doing her homework at the moment.,"verb, 3rd person singular present","verb, gerund or present participle",,,,,moment,,,,,present progressive
301,They went on holiday last month.,"verb, past tense",,,,,,last,month,,,,past simple
302,I visited my best friend yesterday.,"verb, past tense",,,,,,yesterday,,,,,past simple
303,They had math class the day before yesterday.,"verb, past tense",,,,,,day,before,yesterday,,,past simple
304,We flew to Cleveland three weeks ago.,"verb, past tense",,,,,,ago,,,,,past simple
305,The class started twenty minutes ago. ,"verb, past tense",,,,,,ago,,,,,past simple
306,She graduated in 1976.,"verb, past tense",,,,,,,,,,,past simple
307,We are going to visit our friends in Chicago next week.,"verb, non-3rd person singular present","verb, gerund or present participle","verb, base form",,,,next,week,,,,future simple
308,I will have some time off next month. ,"verb, modal auxiliary","verb, base form",,,,,time,next,month,,,future simple
309,He will be at the meeting tomorrow.,"verb, modal auxiliary","verb, base form",,,,,tomorrow,,,,,future simple
310,We will be swimming in a crystal blue sea in two weeks time.,"verb, modal auxiliary","verb, base form","verb, gerund or present participle",,,,weeks,time,,,,future simple
311,I will have finished the report by April 15.,"verb, modal auxiliary","verb, base form","verb, past participle",,,,by,,,,,future simple
312,We will be swimming in a crystal blue sea in two weeks time.,"verb, modal auxiliary","verb, base form","verb, gerund or present participle",,,,weeks,time,,,,future progressive
313,We will be walking in streets of London in two weeks time.,"verb, modal auxiliary","verb, base form","verb, gerund or present participle",,,,weeks,time,,,,future progressive
314,We will be walking in streets of London in two weeks.,"verb, modal auxiliary","verb, base form","verb, gerund or present participle",,,,weeks,,,,,future progressive
315,I will have finished the report by April 15,"verb, modal auxiliary","verb, base form","verb, past participle",,,,by,,,,,future perfect
316,I will have finished the report by tomorrow,"verb, modal auxiliary","verb, base form","verb, past participle",,,,by,tomorrow,,,,future perfect
317,I will have finished the report by next week,"verb, modal auxiliary","verb, base form","verb, past participle",,,,by,next,week,,,future perfect
318,I will have finished the report by next month,"verb, modal auxiliary","verb, base form","verb, past participle",,,,by,next,month,,,future perfect
319,I will have finished the report by next year,"verb, modal auxiliary","verb, base form","verb, past participle",,,,by,next,year,,,future perfect
320,It was raining at noon yesterday.,"verb, past tense","verb, gerund or present participle",,,,,noon,yesterday,,,,past progressive
321,I was not visiting the museum at ten yesterday.,"verb, past tense","verb, gerund or present participle",,,,,yesterday,,,,,past progressive
322,"At three o’clock yesterday, I was working in the garden.","verb, past tense","verb, gerund or present participle",,,,,yesterday,,,,,past progressive
323,I was working in the garden all day yesterday.,"verb, past tense","verb, gerund or present participle",,,,,day,yesterday,,,,past progressive
324,Yesterday at 7 o'clock Judi was washing the dishes.,"verb, past tense","verb, gerund or present participle",,,,,Yesterday,,,,,past progressive
325,Judi was washing the dishes the entire evening.,"verb, past tense","verb, gerund or present participle",,,,,evening,,,,,past progressive
326,He was flying all day.,"verb, past tense","verb, gerund or present participle",,,,,day,,,,,past progressive
327,Yesterday morning the kids were playing.,"verb, past tense","verb, gerund or present participle",,,,,Yesterday,morning,,,,past progressive
328,Yesterday morning the kids were playing all day long.,"verb, past tense","verb, gerund or present participle",,,,,Yesterday,morning,day,,,past progressive
329,He was sitting outside for too long.,"verb, past tense","verb, gerund or present participle",,,,,for,,,,,past progressive
330,Last night at 8 o'clock we were dancing.,"verb, past tense","verb, gerund or present participle",,,,,Last,night,,,,past progressive
331,He was working at 10 o'clock this morning.,"verb, past tense","verb, gerund or present participle",,,,,this,morning,,,,past progressive
332,She was always leaving me with all the paperwork.,"verb, past tense","verb, gerund or present participle",,,,,always,,,,,past progressive
333,SHe was always sleeping on duty.,"verb, past tense","verb, gerund or present participle",,,,,always,,,,,past progressive
334,He was always sleeping on duty.,"verb, past tense","verb, gerund or present participle",,,,,always,,,,,past progressive
335,Harold had known about it for a while.,"verb, past tense","verb, past participle",,,,,for,while,,,,past perfect
336,I had not eaten at that restaurant before today.,"verb, past tense","verb, past participle",,,,,before,today,,,,past perfect
337,Samantha hadn’t had time to explain her side of the story.,"verb, past tense","verb, past tense","verb, base form",,,,time,,,,,past perfect
338,My friends hadn’t ever gone to France.,"verb, past tense","verb, past participle",,,,,ever,,,,,past perfect
339,My friends had never gone to the USA either.,"verb, past tense","verb, past participle",,,,,never,,,,,past perfect
340,Had you cleaned up the mess by the time they came home?,"verb, past tense","verb, past participle","verb, past tense",,,,by,time,,,,past perfect
341,Had Adam ever spoken to the CEO before he was fired?,"verb, past tense","verb, past participle","verb, past tense","verb, past participle",,,ever,before,,,,past perfect
342,What had they said that made him so angry?,"verb, past tense","verb, past tense","verb, past tense",,,,so,,,,,past perfect
343,Why had he agreed to work for that salary?,"verb, past tense","verb, past tense","verb, base form",,,,for,,,,,past perfect
344,How much had he drunk before you got to him?,"verb, past tense","verb, past tense",,,,,before,,,,,past perfect
345,She said she had bought the hat in Paris.,"verb, past tense","verb, past tense","verb, past participle",,,,,,,,,past perfect
346,They had already scored before the 9 o'clock break.,"verb, past tense","verb, past participle",,,,,already,before,,,,past perfect
347,He had finished building his house before 1999.,"verb, past tense","verb, past participle","verb, gerund or present participle",,,,before,,,,,past perfect
348,She had never played basketball before 2002.,"verb, past tense","verb, past participle",,,,,never,before,,,,past perfect
349,He had liked her before this happened.,"verb, past tense","verb, past participle","verb, past tense",,,,before,this,,,,past perfect
350,I had studied English for several years before I traveled to the U.S.,"verb, past tense","verb, past participle","verb, past tense",,,,for,years,before,,,past perfect
351,I hadn’t studied English before I traveled to the U.S.,"verb, past tense","verb, past participle","verb, past tense",,,,before,,,,,past perfect
352,The meeting had already started by the time I arrived.,"verb, past tense","verb, past participle","verb, past tense",,,,already,by,time,,,past perfect
353,They were married from 2008-2011.,"verb, past tense","verb, past participle",,,,,,,,,,past perfect
354,They got divorced in 2011.,"verb, past tense","verb, past participle",,,,,,,,,,past perfect
355,I saw that she‘d called me twice.,"verb, past tense","verb, past tense",,,,,twice,,,,,past perfect
356,"By the end of the day, I‘d written two hundred e-mails.","verb, 3rd person singular present","verb, past tense",,,,,By,day,,,,past perfect
357,I had had five different jobs by the time I was 30 years old.,"verb, past tense","verb, past participle","verb, past tense",,,,by,time,years,,,past perfect
358,I‘d had five different jobs by the time I was 30 years old.,"verb, past tense","verb, past tense",,,,,by,time,years,,,past perfect
359,I had had five different jobs by the time I was 30 years old.,"verb, past tense","verb, past participle","verb, past tense",,,,by,time,years,,,past perfect
360,"When I saw him, I could tell that he had had too much to drink.","verb, past tense","verb, modal auxiliary","verb, base form","verb, past tense","verb, past participle",,"verb, base form",,,,,past perfect
361,I told my boss that I hadn’t had enough time to finish the project.,"verb, past tense","verb, past tense","verb, past tense","verb, base form",,,time,,,,,past perfect
362,We had never had an argument until last week.,"verb, past tense","verb, past participle",,,,,never,until,last,week,,past perfect
363,I had finished all the work by the time you called.,"verb, past tense","verb, past participle","verb, past tense",,,,by,time,,,,past perfect
364,"When we arrived at the airport, our flight had already left.","verb, past tense","verb, past tense","verb, past participle",,,,When,already,,,,past perfect
365,"Before we sold our car, we had owned it for 12 years.","verb, past tense","verb, past tense","verb, past participle",,,,Before,for,years,,,past perfect
366,He had never met a native English speaker until he visited London.,"verb, past tense","verb, past participle","verb, past tense",,,,never,until,,,,past perfect
367,She said that she had lost her wallet.,"verb, past tense","verb, past tense","verb, past participle",,,,,,,,,past perfect
368,"Although he had gone for interviews in several big companies, nobody had hired him.","verb, past tense","verb, past participle","verb, past tense","verb, past participle",,,for,,,,,past perfect
369,Richard had gone out when his wife arrived in the office.,"verb, past tense","verb, past participle","verb, past tense",,,,when,,,,,past perfect
370,Christine had never been to an opera before last night.,"verb, past tense","verb, past participle",,,,,never,before,last,night,,past perfect
371,I got stuck in traffic because there had been an accident.,"verb, past tense","verb, past participle","verb, past tense","verb, past participle",,,,,,,,past perfect
372,I had been to London twice by the time I got a job in New York.,"verb, past tense","verb, past participle","verb, past tense",,,,twice,by,time,,,past perfect
373,The girls have played tennis at the club since 2005.,"verb, non-3rd person singular present","verb, past participle",,,,,since,,,,,present perfect
374,I have already made several calls. ,"verb, non-3rd person singular present","verb, past participle",,,,,already,,,,,present perfect
375,I’ve used those images before.,"verb, base form","verb, past tense",,,,,before,,,,,present perfect
376,He’s already had the surgery.,"verb, past tense",,,,,,already,,,,,present perfect
