,text,verb1,verb2,verb3,verb4,verb5,verb6,time_exp1,time_exp2,time_exp3,time_exp4,time_exp5,tense
377,We’ve just gotten home.,"verb, base form","verb, past participle",,,,,just,,,,,present perfect
378,He has sung that song.,"verb, 3rd person singular present","verb, past participle",,,,,,,,,,present perfect
379,I haven’t eaten at that restaurant in a long time.,"verb, non-3rd person singular present","verb, past participle",,,,,time,,,,,present perfect
380,Jim hasn’t worked on Fridays since he joined the company.,"verb, 3rd person singular present","verb, past tense","verb, past tense",,,,since,,,,,present perfect
381,Jim hasn’t worked on Fridays since last June.,"verb, 3rd person singular present","verb, past tense",,,,,since,last,,,,present perfect
382,Jim hasn’t worked on Fridays since 1990.,"verb, 3rd person singular present","verb, past tense",,,,,since,,,,,present perfect
383,My friends haven’t ever gone to France.,"verb, non-3rd person singular present","verb, past participle",,,,,ever,,,,,present perfect
384,I have not forgiven you!,"verb, non-3rd person singular present","verb, past participle",,,,,,,,,,present perfect
385,Have you ever gone ice skating?,"verb, non-3rd person singular present","verb, past participle","verb, gerund or present participle",,,,ever,,,,,present perfect
386,Have you ever been in London before?,"verb, non-3rd person singular present","verb, past participle",,,,,ever,before,,,,present perfect
387,Have you ever been in London?,"verb, non-3rd person singular present","verb, past participle",,,,,ever,,,,,present perfect
388,Has Jerry presented his ideas to the CEO yet?,"verb, 3rd person singular present","verb, past tense",,,,,yet,,,,,present perfect
389,Have you married with that girl yet?,"verb, non-3rd person singular present","verb, past participle",,,,,yet,,,,,present perfect
390,Have you married with that girl?,"verb, non-3rd person singular present","verb, past participle",,,,,,,,,,present perfect
391,I have never lied to you,"verb, non-3rd person singular present","verb, past participle",,,,,never,,,,,present perfect
392,Tanya has left the coutry,"verb, 3rd person singular present","verb, past participle",,,,,,,,,,present perfect
393,How much money have you spent so far?,"verb, non-3rd person singular present","verb, past participle",,,,,so,far,,,,present perfect
394,John has known her for a couple of years.,"verb, 3rd person singular present","verb, past participle",,,,,for,years,,,,present perfect
395,John has known her for a couple of years.,"verb, 3rd person singular present","verb, past participle",,,,,for,years,,,,present perfect
396,Keisha hasn’t spoken to you yet.,"verb, 3rd person singular present","verb, past participle",,,,,yet,,,,,present perfect
397,Those kids have never played rugby.,"verb, non-3rd person singular present","verb, past participle",,,,,never,,,,,present perfect
398,Those kids have never played rugby before.,"verb, non-3rd person singular present","verb, past participle","verb, past participle",,,,never,before,,,,present perfect
399,Dan has worked in that company for 12 years.,"verb, 3rd person singular present","verb, past participle",,,,,for,years,,,,present perfect
400,Have you heard the news?,"verb, non-3rd person singular present","verb, past participle",,,,,,,,,,present perfect
401,The boys have never eaten sushi.,"verb, non-3rd person singular present","verb, past participle",,,,,never,,,,,present perfect
402,The boys have never eaten sushi before.,"verb, non-3rd person singular present","verb, past participle",,,,,never,before,,,,present perfect
403,Rani has broken her arm.,"verb, 3rd person singular present","verb, past participle",,,,,,,,,,present perfect
404,I’ve already made several calls.,"verb, base form","verb, past tense",,,,,already,,,,,present perfect
405,I have lost my dictionary.,"verb, non-3rd person singular present","verb, past participle",,,,,,,,,,present perfect
406,Mary has fixed my computer.,"verb, 3rd person singular present","verb, past participle",,,,,,,,,,present perfect
407,You haven't eaten very much.,"verb, non-3rd person singular present","verb, past participle",,,,,,,,,,present perfect
408,You have not eaten very much.,"verb, non-3rd person singular present","verb, past participle",,,,,,,,,,present perfect
409,I haven't read his letter. ,"verb, non-3rd person singular present","verb, past participle",,,,,,,,,,present perfect
410,Have you seen my calculator?,"verb, non-3rd person singular present","verb, past participle",,,,,,,,,,present perfect
411,Has she had an accident?,"verb, 3rd person singular present","verb, past tense",,,,,,,,,,present perfect
412,Have you done your homework?,"verb, non-3rd person singular present","verb, past participle",,,,,,,,,,present perfect
413,I've played tennis 3 times already this week,"verb, base form","verb, past participle",,,,,times,already,this,week,,present perfect
414,She's been back to Korea twice already this year,"verb, 3rd person singular present","verb, past participle",,,,,twice,already,this,year,,present perfect
415,"Sorry, I have seen that film already.","verb, non-3rd person singular present","verb, past participle",,,,,already,,,,,present perfect
416,I've lived in Germany since 1986.,"verb, base form","verb, past participle",,,,,since,,,,,present perfect
417,She's had a lot of bad luck recently.,"verb, 3rd person singular present","verb, past participle",,,,,recently,,,,,present perfect
418,I haven't seen my mother for 2 months.,"verb, non-3rd person singular present","verb, past participle",,,,,for,months,,,,present perfect
419,You haven't finished the exercise yet.,"verb, non-3rd person singular present","verb, past participle",,,,,yet,,,,,present perfect
420,She hasn't called me lately.,"verb, 3rd person singular present","verb, past participle",,,,,lately,,,,,present perfect
421,Have you ever seen a ghost?,"verb, non-3rd person singular present","verb, past participle",,,,,ever,,,,,present perfect
422,Has he lived here all his life?,"verb, 3rd person singular present","verb, past tense",,,,,,,,,,present perfect
423,Has the postman been yet?,"verb, 3rd person singular present","verb, past participle",,,,,yet,,,,,present perfect
424,I drank three cups of coffee this morning.,"verb, past tense",,,,,,this,morning,,,,past simple
425,I didn't see John today.,"verb, past tense","verb, base form",,,,,today,,,,,past simple
426,This year was a very good year for me!,"verb, past tense",,,,,,This,year,year,for,,past simple
427,"When I turn thirty, I will have been playing piano for twenty-one years.","verb, non-3rd person singular present","verb, modal auxiliary","verb, base form","verb, past participle","verb, gerund or present participle",,When,for,years,,,future perfect progressive
428,"On Thursday, I will have known you for a week.","verb, modal auxiliary","verb, base form","verb, past participle",,,,for,week,,,,future perfect progressive
429,I will have read forty-five books by Christmas.,"verb, modal auxiliary","verb, base form","verb, past participle",,,,by,,,,,future perfect progressive
430,"By the next year, I will have been working as a teacher for 30 years.","verb, modal auxiliary","verb, base form","verb, past participle","verb, gerund or present participle",,,By,next,year,as,for,future perfect progressive
431,We will be making a rest stop in half an hour because you will have been driving the car for 6 hours by then.,"verb, modal auxiliary","verb, base form","verb, gerund or present participle","verb, modal auxiliary","verb, base form",,for,by,,,,future perfect progressive
432,The company will have been negotiating the contract for three months by June.,"verb, modal auxiliary","verb, base form","verb, past participle","verb, gerund or present participle",,,for,months,by,,,future perfect progressive
433,"Before they come, we will have been cleaning the house for 5 hours.","verb, non-3rd person singular present","verb, modal auxiliary","verb, base form","verb, past participle","verb, gerund or present participle",,Before,for,,,,future perfect progressive
434,We will have been cleaning the house for 5 hours.,"verb, modal auxiliary","verb, base form","verb, past participle","verb, gerund or present participle",,,for,,,,,future perfect progressive
435,"By the next year, Ben and his wife will have been living together for 50 years.","verb, modal auxiliary","verb, base form","verb, past participle","verb, gerund or present participle",,,By,next,year,for,years,future perfect progressive
436,Ben and his wife will have been living together for 50 years.,"verb, modal auxiliary","verb, base form","verb, past participle","verb, gerund or present participle",,,for,years,,,,future perfect progressive
437,The company will have been negotiating the the contract for two months by June.,"verb, modal auxiliary","verb, base form","verb, past participle","verb, gerund or present participle",,,for,months,by,,,future perfect progressive
438,"By this time, he will have been working for 12 hours.","verb, modal auxiliary","verb, base form","verb, past participle","verb, gerund or present participle",,,By,this,time,for,,future perfect progressive
439,He will have been exercising for over 2 hours.,"verb, modal auxiliary","verb, base form","verb, past participle","verb, gerund or present participle",,,for,,,,,future perfect progressive
440,In the summer Mike will have been trying to find a new job for five months.,"verb, modal auxiliary","verb, base form","verb, past participle","verb, gerund or present participle","verb, base form",,for,months,,,,future perfect progressive
441,"Jane will be very tired when she comes home, because she will have been flying over 24 hours.","verb, modal auxiliary","verb, base form","verb, 3rd person singular present","verb, modal auxiliary","verb, base form",,"verb, past participle","verb, gerund or present participle",,,,future perfect progressive
442,My father and I will have been breeding sheep for 20 years tomorrow.,"verb, modal auxiliary","verb, base form","verb, past participle","verb, gerund or present participle",,,for,years,tomorrow,,,future perfect progressive
443,"By the year 2020, linguists will have been studying and defining the Indo-European language family for more than 200 years.","verb, modal auxiliary","verb, base form","verb, past participle","verb, gerund or present participle","verb, gerund or present participle",,By,year,for,years,,future perfect progressive
444,She won't have been writing the book for four months by the end of October.,"verb, base form","verb, past participle","verb, gerund or present participle",,,,for,months,by,,,future perfect progressive
445,Will he have been writing the composition for a month by the end of February?,"verb, modal auxiliary","verb, base form","verb, past participle","verb, gerund or present participle",,,for,month,by,,,future perfect progressive
446,You will have been waiting for more than two hours when her plane finally arrives.,"verb, modal auxiliary","verb, base form","verb, past participle","verb, gerund or present participle","verb, 3rd person singular present",,for,when,,,,future perfect progressive
447,They will have been talking for over an hour by the time Thomas arrives.,"verb, modal auxiliary","verb, base form","verb, past participle","verb, gerund or present participle","verb, 3rd person singular present",,for,by,time,,,future perfect progressive
448,How long will you have been studying when you graduate?,"verb, modal auxiliary","verb, base form","verb, past participle","verb, gerund or present participle","verb, non-3rd person singular present",,when,,,,,future perfect progressive
449,Ned will have had his driver's license for over two years.,"verb, modal auxiliary","verb, base form","verb, past participle",,,,for,years,,,,future perfect progressive
450,You will only have been waiting for a few minutes when her plane arrives.,"verb, modal auxiliary","verb, base form","verb, past participle","verb, gerund or present participle","verb, 3rd person singular present",,for,few,when,,,future perfect progressive
451,You are only going to have been waiting for a few minutes when her plane arrives.,"verb, non-3rd person singular present","verb, gerund or present participle","verb, base form","verb, past participle","verb, gerund or present participle","verb, 3rd person singular present",for,few,when,,,future perfect progressive
452,Jason will be tired when he gets home because he will have been jogging for over an hour.,"verb, modal auxiliary","verb, base form","verb, 3rd person singular present","verb, modal auxiliary","verb, base form","verb, past participle","verb, gerund or present participle",for,,,,future perfect progressive
453,She is going to have been working at that company for three years when it finally closes.,"verb, 3rd person singular present","verb, gerund or present participle","verb, base form","verb, past participle","verb, gerund or present participle","verb, 3rd person singular present",for,years,when,,,future perfect progressive
454,James will have been teaching at the university for more than a year by the time he leaves for Asia.,"verb, modal auxiliary","verb, base form","verb, past participle","verb, gerund or present participle","verb, 3rd person singular present",,for,year,by,time,for,future perfect progressive
455,You are going to have been waiting for more than two hours when her plane finally arrives.,"verb, non-3rd person singular present","verb, gerund or present participle","verb, base form","verb, past participle","verb, gerund or present participle","verb, 3rd person singular present",for,when,,,,future perfect progressive
456,"At five o’clock, I will be meeting with the management about my raise.","verb, modal auxiliary","verb, base form","verb, gerund or present participle",,,,,,,,,future progressive
457,Michael will be running a marathon this Saturday.,"verb, modal auxiliary","verb, base form","verb, gerund or present participle",,,,this,,,,,future progressive
458,Eric will be competing against Michael in the race.,"verb, modal auxiliary","verb, base form","verb, gerund or present participle",,,,,,,,,future progressive
459,I will be watching Michael and Eric race.,"verb, modal auxiliary","verb, base form","verb, gerund or present participle",,,,,,,,,future progressive
460,I will be working tonight.,"verb, modal auxiliary","verb, base form","verb, gerund or present participle",,,,tonight,,,,,future progressive
461,She will be playing at the theather this evening.,"verb, modal auxiliary","verb, base form","verb, gerund or present participle",,,,this,evening,,,,future progressive
462,She will be playing at the theather.,"verb, modal auxiliary","verb, base form","verb, gerund or present participle",,,,,,,,,future progressive
463,I will be working.,"verb, modal auxiliary","verb, base form","verb, gerund or present participle",,,,,,,,,future progressive
464,This time tomorrow I will be lying on the beach.,"verb, modal auxiliary","verb, base form","verb, gerund or present participle",,,,This,time,tomorrow,,,future progressive
465,This time tomorrow I will be celebrating my birthday.,"verb, modal auxiliary","verb, base form","verb, gerund or present participle",,,,This,time,tomorrow,,,future progressive
466,This time next week I will be taking my exam.,"verb, modal auxiliary","verb, base form","verb, gerund or present participle",,,,This,time,next,week,,future progressive
467,This time tomorrow I will be waiting at the doctor’s office.,"verb, modal auxiliary","verb, base form","verb, gerund or present participle",,,,This,time,tomorrow,,,future progressive
468,She will be giving a presentation at 4 o’clock in the afternoon.,"verb, modal auxiliary","verb, base form","verb, gerund or present participle",,,,afternoon,,,,,future progressive
469,Tomorrow at 8 o'clock James will be cleaning the house.,"verb, modal auxiliary","verb, base form","verb, gerund or present participle",,,,Tomorrow,,,,,future progressive
470,James will be cleaning the house all morning.,"verb, modal auxiliary","verb, base form","verb, gerund or present participle",,,,morning,,,,,future progressive
471,I will be studying all weekend,"verb, modal auxiliary","verb, base form","verb, gerund or present participle",,,,weekend,,,,,future progressive
472,James will be cleaning the house when I arrive.,"verb, modal auxiliary","verb, base form","verb, gerund or present participle","verb, non-3rd person singular present",,,when,,,,,future progressive
473,She will be singing all night.,"verb, modal auxiliary","verb, base form","verb, gerund or present participle",,,,night,,,,,future progressive
474,We will be doing business next year.,"verb, modal auxiliary","verb, base form","verb, gerund or present participle",,,,next,year,,,,future progressive
475,He will be driving for a while.,"verb, modal auxiliary","verb, base form","verb, gerund or present participle",,,,for,while,,,,future progressive
476,An hour from now he will be lying in a hospital.,"verb, modal auxiliary","verb, base form","verb, gerund or present participle",,,,now,,,,,future progressive
477,At ten o'clock tonight she will be meeting her boyfriend.,"verb, modal auxiliary","verb, base form","verb, gerund or present participle",,,,tonight,,,,,future progressive
478,He will be shouting until he gets tired.,"verb, modal auxiliary","verb, base form","verb, gerund or present participle","verb, 3rd person singular present",,,until,,,,,future progressive
479,"When he comes, she will be waiting.","verb, 3rd person singular present","verb, modal auxiliary","verb, base form","verb, gerund or present participle",,,When,,,,,future progressive
480,She will be walking confidently when she returns.,"verb, modal auxiliary","verb, base form","verb, gerund or present participle","verb, 3rd person singular present",,,when,,,,,future progressive
481,"Janet will be talking, and Emily will be listening to every word.","verb, modal auxiliary","verb, base form","verb, gerund or present participle","verb, modal auxiliary","verb, base form","verb, gerund or present participle",every,,,,,future progressive
482,You had been waiting there for more than two hours when she finally arrived.,"verb, past tense","verb, past participle","verb, gerund or present participle","verb, past tense",,,for,when,,,,past perfect progressive
483,You had not been waiting there for more than two hours when she finally arrived.,"verb, past tense","verb, past participle","verb, gerund or present participle","verb, past tense",,,for,when,,,,past perfect progressive
484,They had been talking for over an hour before Tony arrived.,"verb, past tense","verb, past participle","verb, gerund or present participle","verb, past tense",,,for,before,,,,past perfect progressive
485,She had been working at that company for three years when it went out of business.,"verb, past tense","verb, past participle","verb, gerund or present participle","verb, past tense",,,for,years,when,,,past perfect progressive
486,How long had you been waiting to get on the bus?,"verb, past tense","verb, past participle","verb, gerund or present participle","verb, base form",,,,,,,,past perfect progressive
487,Mike wanted to sit down because he had been standing all day at work.,"verb, past tense","verb, base form","verb, past tense","verb, past participle","verb, gerund or present participle",,day,,,,,past perfect progressive
488,How long had you been studying Turkish before you moved to Ankara?,"verb, past tense","verb, past participle","verb, gerund or present participle","verb, past tense",,,before,,,,,past perfect progressive
489,I had not been studying Turkish very long.,"verb, past tense","verb, past participle","verb, gerund or present participle",,,,,,,,,past perfect progressive
490,Jason was tired because he had been jogging.,"verb, past tense","verb, past tense","verb, past participle","verb, gerund or present participle",,,,,,,,past perfect progressive
491,Sam gained weight because he had been overeating.,"verb, past tense","verb, past tense","verb, past participle","verb, gerund or present participle",,,,,,,,past perfect progressive
492,Betty failed the final test because she had not been attending class.,"verb, past tense","verb, past tense","verb, past participle","verb, gerund or present participle",,,,,,,,past perfect progressive
493,Chef Jones had been preparing the restaurant's fantastic dinners for two years before he moved to Paris. ,"verb, past tense","verb, past participle","verb, gerund or present participle","verb, past tense",,,for,years,before,,,past perfect progressive
494,Chef Jones had been preparing the restaurant's fantastic dinners for two years. ,"verb, past tense","verb, past participle","verb, gerund or present participle",,,,for,years,,,,past perfect progressive
495,The motorcycle had belonged to George for years before Tina bought it.,"verb, past tense","verb, past participle","verb, past tense",,,,for,years,before,,,past perfect progressive
496,The motorcycle had belonged to George for years.,"verb, past tense","verb, past participle",,,,,for,years,,,,past perfect progressive
497,Ben had been working for three hours when Rachel came home.,"verb, past tense","verb, past participle","verb, gerund or present participle","verb, past tense",,,for,when,,,,past perfect progressive
498,Ben had been working for three hours.,"verb, past tense","verb, past participle","verb, gerund or present participle",,,,for,,,,,past perfect progressive
499,"By the time Sam found an umbrella, it had been raining for ten minutes.","verb, past tense","verb, past tense","verb, past participle","verb, gerund or present participle",,,By,time,for,,,past perfect progressive
500,it had been raining for ten minutes.,"verb, past tense","verb, past participle","verb, gerund or present participle",,,,for,,,,,past perfect progressive
501,"By the time Catherine got to the office, the client had been waiting for an hour.","verb, past tense","verb, past tense","verb, past participle","verb, gerund or present participle",,,By,time,for,,,past perfect progressive
502,The client had been waiting for an hour.,"verb, past tense","verb, past participle","verb, gerund or present participle",,,,for,,,,,past perfect progressive
503,I had been feeding the dogs when I tripped and fell.,"verb, past tense","verb, past participle","verb, gerund or present participle","verb, past tense","verb, past tense",,when,,,,,past perfect progressive
504,"He hadn’t been feeling well, so I sent him away.","verb, past tense","verb, past participle","verb, gerund or present participle","verb, past tense",,,so,,,,,past perfect progressive
505,He hadn’t been feeling well.,"verb, past tense","verb, past participle","verb, gerund or present participle",,,,,,,,,past perfect progressive
506,Simon had not been expecting a positive answer when he got a job.,"verb, past tense","verb, past participle","verb, gerund or present participle","verb, past tense",,,when,,,,,past perfect progressive
507,Simon had not been expecting a positive answer.,"verb, past tense","verb, past participle","verb, gerund or present participle",,,,,,,,,past perfect progressive
508,The hikers hadn’t been walking long before they got lost.,"verb, past tense","verb, past participle","verb, gerund or present participle","verb, past tense","verb, past participle",,before,,,,,past perfect progressive
509,Mrs Smith has been picking strawberries for two hours.,"verb, 3rd person singular present","verb, past participle","verb, gerund or present participle",,,,for,,,,,present perfect progressive
510,He has been playing Rugby with is friends.,"verb, 3rd person singular present","verb, past participle","verb, gerund or present participle","verb, 3rd person singular present",,,,,,,,present perfect progressive
511,He has been playing Rugby with is friends all day long.,"verb, 3rd person singular present","verb, past participle","verb, gerund or present participle","verb, 3rd person singular present",,,day,,,,,present perfect progressive
512,John has been feeling sick all afternoon.,"verb, 3rd person singular present","verb, past participle","verb, gerund or present participle",,,,afternoon,,,,,present perfect progressive
513,John has been feeling sick all weekend.,"verb, 3rd person singular present","verb, past participle","verb, gerund or present participle",,,,weekend,,,,,present perfect progressive
514,She has been working with us for ten years.,"verb, 3rd person singular present","verb, past participle","verb, gerund or present participle",,,,for,years,,,,present perfect progressive
515,She has been studying to become a lawyer for five years.,"verb, 3rd person singular present","verb, past participle","verb, gerund or present participle","verb, base form",,,for,years,,,,present perfect progressive
516,They have been living here since 1999.,"verb, non-3rd person singular present","verb, past participle","verb, gerund or present participle",,,,since,,,,,present perfect progressive
517,I have not talked to Simon since last Monday.,"verb, non-3rd person singular present","verb, past participle",,,,,since,last,,,,present perfect progressive
518,We have known Mr and Mrs Bean for twenty years.,"verb, non-3rd person singular present","verb, past participle",,,,,for,years,,,,present perfect progressive
519,I have not seen Chloe for a long time.,"verb, non-3rd person singular present","verb, past participle",,,,,for,time,,,,present perfect progressive
520,Mr and Mrs Bean have been married since August last year.,"verb, non-3rd person singular present","verb, past participle","verb, past participle",,,,since,last,year,,,present perfect progressive
521,I have not talked to Simon since last Monday.,"verb, non-3rd person singular present","verb, past participle",,,,,since,last,,,,present perfect progressive
