,text,verb1,verb2,verb3,verb4,verb5,verb6,time_exp1,time_exp2,time_exp3,time_exp4,time_exp5,tense
0,I drive home every day.,"verb, non-3rd person singular present",,,,,,every,day,,,,present simple
1,I drove home yesterday.,"verb, past tense",,,,,,yesterday,,,,,past simple
2,I will drive home later.,"verb, modal auxiliary","verb, base form",,,,,,,,,,future simple
3,I was driving when you called.,"verb, past tense","verb, gerund or present participle","verb, past tense",,,,when,,,,,past progressive
4,I am driving now.,"verb, non-3rd person singular present","verb, gerund or present participle",,,,,now,,,,,present progressive
5,I will be driving when you call.,"verb, modal auxiliary","verb, base form","verb, gerund or present participle","verb, non-3rd person singular present",,,when,,,,,future progressive
6,I have driven that road.,"verb, non-3rd person singular present","verb, past participle",,,,,,,,,,present perfect
7,I had already driven that road in the past.,"verb, past tense","verb, past participle",,,,,already,past,,,,past perfect
8,I will have driven 200 miles by tomorrow.,"verb, modal auxiliary","verb, base form","verb, past participle",,,,by,tomorrow,,,,future perfect
9,I have been driving since this morning.,"verb, non-3rd person singular present","verb, past participle","verb, gerund or present participle",,,,since,this,,,,present perfect progressive
10,I had been driving for three hours before I stopped to get gas.,"verb, past tense","verb, past participle","verb, gerund or present participle","verb, past tense","verb, base form",,for,before,,,,past perfect progressive
11,I will have been driving for five hours by the time I arrive.,"verb, modal auxiliary","verb, base form","verb, past participle","verb, gerund or present participle","verb, non-3rd person singular present",,for,by,time,,,future perfect progressive
12,Did you get enough sleep last night?,"verb, past tense","verb, base form",,,,,last,,,,,past simple
13,Do you shower every day?,"verb, non-3rd person singular present","verb, base form",,,,,every,day,,,,present simple
14,Are you going to study tonight?,"verb, non-3rd person singular present","verb, gerund or present participle","verb, base form",,,,,,,,,future simple
15,What were you doing when I called you last night?,"verb, past tense","verb, gerund or present participle","verb, past tense",,,,when,last,,,,past progressive
16,What are you doing right now?,"verb, non-3rd person singular present","verb, gerund or present participle",,,,,right,now,,,,present progressive
17,What will you be doing at midnight on New Year’s Eve?,"verb, modal auxiliary","verb, base form","verb, gerund or present participle",,,,,,,,,future progressive
18,Had you ever tried skiing before today?,"verb, past tense","verb, past participle",,,,,ever,before,today,,,past perfect
19,Have you ever broken the law?,"verb, non-3rd person singular present","verb, past participle",,,,,ever,,,,,present perfect
20,Will you have gotten married by the time you turn 30?,"verb, modal auxiliary","verb, base form","verb, past participle","verb, past participle","verb, non-3rd person singular present",,by,time,,,,future perfect
21,How long had you been smoking before you quit?,"verb, past tense","verb, past participle","verb, gerund or present participle","verb, non-3rd person singular present",,,before,,,,,past perfect progressive
22,How long have you been waiting for the bus?,"verb, non-3rd person singular present","verb, past participle","verb, gerund or present participle",,,,for,,,,,present perfect progressive
23,How long will you have been working before you retire?,"verb, modal auxiliary","verb, base form","verb, past participle","verb, gerund or present participle","verb, non-3rd person singular present",,before,,,,,future perfect progressive
24,It snowed yesterday.,"verb, past tense",,,,,,yesterday,,,,,past simple
25,It snows every winter.,"verb, 3rd person singular present",,,,,,every,,,,,present simple
26,It is going to snow tonight.,"verb, 3rd person singular present","verb, gerund or present participle","verb, base form",,,,,,,,,future simple
27,It will snow this winter.,"verb, modal auxiliary","verb, base form",,,,,this,,,,,future simple
28,It was snowing when I drove to work.,"verb, past tense","verb, gerund or present participle","verb, past tense",,,,when,,,,,present progressive
29,It is snowing.,"verb, 3rd person singular present","verb, gerund or present participle",,,,,,,,,,present progressive
30,It will be snowing by the time I get home.,"verb, modal auxiliary","verb, base form","verb, gerund or present participle","verb, non-3rd person singular present",,,by,time,,,,future progressive
31,It had already snowed before I left.,"verb, past tense","verb, past participle","verb, past tense",,,,already,before,,,,past perfect
32,I have driven in snow many times.,"verb, non-3rd person singular present","verb, past participle",,,,,times,,,,,present perfect
33,It will have snowed 6 inches by the end of the day.,"verb, modal auxiliary","verb, base form","verb, past participle",,,,by,day,,,,future perfect
34,It had been snowing for two days before it stopped.,"verb, past tense","verb, past participle","verb, gerund or present participle","verb, past tense",,,for,days,before,,,past perfect progressive
35,It has been snowing all month long.,"verb, 3rd person singular present","verb, past participle","verb, gerund or present participle",,,,month,,,,,present perfect progressive
36,It will have been snowing for three days by the time it stops.,"verb, modal auxiliary","verb, base form","verb, past participle","verb, gerund or present participle","verb, 3rd person singular present",,for,days,by,time,,future perfect progressive
37,I left home three years ago.,"verb, past tense",,,,,,ago,,,,,past simple
38,Most kids like milk.,,,,,,,,,,,,present simple
39,I do not like milk unless it’s chocolate.,"verb, non-3rd person singular present","verb, base form",,,,,,,,,,present simple
40,Do you like milk?,"verb, non-3rd person singular present",,,,,,,,,,,present simple
41,When do we board the train for Paris?,"verb, non-3rd person singular present","verb, base form",,,,,for,,,,,present simple
42,"You like scuba diving, don’t you?","verb, non-3rd person singular present","verb, non-3rd person singular present",,,,,,,,,,present simple
43,You are learning to use perfect English.,"verb, non-3rd person singular present","verb, gerund or present participle","verb, base form",,,,,,,,,present progressive
44,You are not sleeping now.,"verb, non-3rd person singular present","verb, gerund or present participle",,,,,now,,,,,present progressive
45,Are you eating?,"verb, non-3rd person singular present","verb, gerund or present participle",,,,,,,,,,present progressive
46,What are you watching?,"verb, non-3rd person singular present","verb, gerund or present participle",,,,,,,,,,present progressive
47,"You aren’t eating liverwurst, are you?","verb, non-3rd person singular present","verb, gerund or present participle","verb, non-3rd person singular present",,,,,,,,,present progressive
48,I visited my grandmother yesterday.,"verb, past tense",,,,,,yesterday,,,,,past simple
49,We didn’t watch the movie on Saturday.,"verb, past tense","verb, base form",,,,,,,,,,past simple
50,Did you have spaghetti for dinner last night?,"verb, past tense","verb, base form",,,,,for,last,,,,past simple
51,Why didn’t you wash the car yesterday?,"verb, past tense","verb, non-3rd person singular present",,,,,yesterday,,,,,past simple
52,"You went to Paris last year, didn’t you?","verb, past tense","verb, past tense",,,,,last,year,,,,past simple
53,We were watching TV when the power went out.,"verb, past tense","verb, gerund or present participle","verb, past tense",,,,when,,,,,past progressive
54,You were not listening to the teacher’s instructions yesterday.,"verb, past tense","verb, gerund or present participle",,,,,yesterday,,,,,past progressive
55,Were you skateboarding when you broke your leg?,"verb, past tense","verb, gerund or present participle","verb, past tense",,,,when,,,,,past progressive
56,What were you doing when you heard the news?,"verb, past tense","verb, gerund or present participle","verb, past tense",,,,when,,,,,past progressive
57,We are going to the movies tonight.,"verb, non-3rd person singular present","verb, gerund or present participle",,,,,,,,,,future simple
58,You will help your grandmother later.,"verb, modal auxiliary","verb, base form",,,,,,,,,,future simple
59,They have been to Paris.,"verb, non-3rd person singular present","verb, past participle",,,,,,,,,,present perfect
60,You haven’t gone overseas.,"verb, non-3rd person singular present","verb, past participle",,,,,,,,,,present perfect
61,Have you been to London?,"verb, non-3rd person singular present","verb, past participle",,,,,,,,,,present perfect
62,Why are we here?,"verb, non-3rd person singular present",,,,,,,,,,,present perfect
63,"You haven’t been to Zurich, have you?","verb, non-3rd person singular present","verb, past participle","verb, non-3rd person singular present",,,,,,,,,present perfect
64,They have been swimming for more than an hour.,"verb, non-3rd person singular present","verb, past participle","verb, gerund or present participle",,,,for,,,,,present perfect progressive
65,You haven’t waited thirty minutes yet.,"verb, non-3rd person singular present","verb, past tense",,,,,yet,,,,,present perfect progressive
66,Have you been waiting long?,"verb, non-3rd person singular present","verb, past participle","verb, gerund or present participle",,,,,,,,,present perfect progressive
67,What time did you begin waiting?,"verb, past tense","verb, base form","verb, gerund or present participle",,,,time,,,,,present perfect progressive
68,"You haven’t been waiting long, have you?","verb, non-3rd person singular present","verb, past participle","verb, gerund or present participle","verb, non-3rd person singular present",,,,,,,,present perfect progressive
69,He had studied French in Paris.,"verb, past tense","verb, past participle",,,,,,,,,,past perfect
70,She hadn’t studied French before last semester.,"verb, past tense","verb, past participle",,,,,before,last,,,,past perfect
71,We had not been waiting for more than thirty minutes when her plane landed.,"verb, past tense","verb, past participle","verb, gerund or present participle","verb, past tense",,,for,when,,,,past perfect progressive
72,We had been waiting for more than three hours when the train finally arrived.,"verb, past tense","verb, past participle","verb, gerund or present participle","verb, past tense",,,for,when,,,,past perfect progressive
73,Had you been waiting for longer than three hours?,"verb, past tense","verb, past participle","verb, gerund or present participle",,,,for,,,,,past perfect progressive
74,Why had you been waiting for the last two hours?,"verb, past tense","verb, past participle","verb, gerund or present participle",,,,for,last,,,,past perfect progressive
75,We will be waiting for him when his plan arrives tonight.,"verb, modal auxiliary","verb, base form","verb, gerund or present participle","verb, 3rd person singular present",,,for,when,,,,future progressive
76,She will see you tomorrow.,"verb, modal auxiliary","verb, base form",,,,,tomorrow,,,,,future simple
77,I'm watching you.,"verb, non-3rd person singular present","verb, gerund or present participle",,,,,,,,,,present progressive
78,Who said that?,"verb, past tense",,,,,,,,,,,past simple
79,I am starting to work.,"verb, non-3rd person singular present","verb, gerund or present participle","verb, base form",,,,,,,,,present progressive
80,I have started,"verb, non-3rd person singular present","verb, past participle",,,,,,,,,,present perfect
81,I was working in the garage.,"verb, past tense","verb, gerund or present participle",,,,,,,,,,past progressive
82,I had been working all day.,"verb, past tense","verb, past participle","verb, gerund or present participle",,,,day,,,,,past perfect progressive
83,I have worked with children before.,"verb, non-3rd person singular present","verb, past participle",,,,,before,,,,,present perfect
84,After I had worked with fake for a few weeks.,"verb, past tense","verb, past participle",,,,,for,few,,,,past perfect
85,I will have worked 10 hours by suppertime.,"verb, modal auxiliary","verb, base form","verb, past participle",,,,by,,,,,future perfect
86,I've been working all day.,"verb, base form","verb, past participle","verb, gerund or present participle",,,,day,,,,,present perfect progressive
87,They are walking home.,"verb, non-3rd person singular present","verb, gerund or present participle",,,,,,,,,,present progressive
88,Peter lived in China in 1965.,"verb, past tense",,,,,,,,,,,past simple
89,I was reading when she arrived home.,"verb, past tense","verb, gerund or present participle","verb, past tense",,,,when,,,,,past progressive
90,I have lived here since 1987.,"verb, non-3rd person singular present","verb, past participle",,,,,since,,,,,present perfect
91,We had been to see her several times before,"verb, past tense","verb, past participle","verb, base form",,,,times,before,,,,past perfect
92,He had been watching her for some time.,"verb, past tense","verb, past participle","verb, gerund or present participle",,,,for,time,,,,past perfect progressive
93,We will have arrived in the States.,"verb, modal auxiliary","verb, base form","verb, past participle",,,,,,,,,future perfect
94,"By the end of your course, you will have been studying for five years.","verb, modal auxiliary","verb, base form","verb, past participle","verb, gerund or present participle",,,for,,,,,future perfect progressive
95,They will go to Italy next week.,"verb, modal auxiliary","verb, base form",,,,,next,week,,,,future simple
96,I will be travelling by train.,"verb, modal auxiliary","verb, base form","verb, gerund or present participle",,,,by,,,,,future progressive
97,I read nearly every day.,"verb, past tense",,,,,,every,day,,,,present simple
98,"Last night, I read an entire novel.","verb, past tense",,,,,,,,,,,past simple
99,I will read as much as I can this year.,"verb, modal auxiliary","verb, base form","verb, modal auxiliary",,,,as,as,this,year,,future simple
100,I am reading Shakespeare at the moment.,"verb, non-3rd person singular present","verb, gerund or present participle",,,,,moment,,,,,present progressive
101,I was reading Edgar Allan Poe last night.,"verb, past tense","verb, gerund or present participle",,,,,last,,,,,past progressive
102,I will be reading Nathaniel Hawthorne soon.,"verb, modal auxiliary","verb, base form","verb, gerund or present participle",,,,soon,,,,,future progressive
103,I have read so many books I can’t keep count.,"verb, non-3rd person singular present","verb, past participle","verb, base form",,,,so,,,,,present perfect
104,I had read at least 100 books at the end of this year.,"verb, past tense","verb, past participle",,,,,this,year,,,,past perfect
105,I will have read at least 500 books by the end of the year.,"verb, modal auxiliary","verb, base form","verb, past participle",,,,by,year,,,,future perfect
106,I have been reading since I was four years old.,"verb, non-3rd person singular present","verb, past participle","verb, gerund or present participle","verb, past tense",,,since,,,,,present perfect progressive
107,I had been reading for at least a year.,"verb, past tense","verb, past participle","verb, gerund or present participle",,,,for,year,,,,past perfect progressive
108,Bill was studying for a test Friday.,"verb, past tense","verb, gerund or present participle",,,,,for,,,,,past progressive
109,Mom and I are hurrying.,"verb, non-3rd person singular present","verb, gerund or present participle",,,,,,,,,,present progressive
110,I will be leaving at 10.,"verb, modal auxiliary","verb, base form","verb, gerund or present participle",,,,,,,,,future progressive
111,Joe had hoped to go to Harvard.,"verb, past tense","verb, past participle","verb, base form",,,,,,,,,past perfect
112,He went to MIT instead.,"verb, past tense",,,,,,,,,,,past simple
113,Ellen has always worked hard.,"verb, 3rd person singular present","verb, past participle",,,,,always,,,,,present perfect
114,She will have studied medicine for over ten years.,"verb, modal auxiliary","verb, base form","verb, past participle",,,,for,,,,,future perfect
115,Yesterday Mark got up early.,"verb, past tense",,,,,,,,,,,past simple
116,He ate breakfast.,"verb, past tense",,,,,,,,,,,past simple
117,He took the bus to work.,"verb, past tense","verb, base form",,,,,,,,,,past simple
118,He worked all day.,"verb, past tense",,,,,,day,,,,,past simple
119,He came home.,"verb, past tense",,,,,,,,,,,past simple
120,He ate dinner.,"verb, past tense",,,,,,,,,,,past simple
121,He listened to some music.,"verb, past tense",,,,,,,,,,,past simple
122,He went to bed.,"verb, past tense",,,,,,,,,,,past simple
123,Mark was still thinking about the day's events.,"verb, past tense","verb, gerund or present participle",,,,,day,,,,,past progressive
124,this morning he was getting ready for bed.,"verb, past tense","verb, gerund or present participle",,,,,this,for,,,,past progressive
125,He used to go to bed late.,"verb, past tense","verb, base form",,,,,,,,,,past simple
126,Beth used to call every evening before supper.,"verb, past tense","verb, base form",,,,,every,before,,,,past simple
127,Mark had not been worrying.,"verb, past tense","verb, past participle","verb, gerund or present participle",,,,,,,,,past perfect
128,he had been too tired to even notice.,"verb, past tense","verb, past participle","verb, base form",,,,,,,,,past perfect
129,she had not called.,"verb, past tense","verb, past participle",,,,,,,,,,past perfect
130,You should have just sent a text message.,"verb, modal auxiliary","verb, base form","verb, past participle",,,,just,,,,,past perfect
131,I would have called you.,"verb, modal auxiliary","verb, base form","verb, past participle",,,,,,,,,past perfect
132,I had started to worry.,"verb, past tense","verb, past participle","verb, base form",,,,,,,,,past perfect
133,I should have gone with you.,"verb, modal auxiliary","verb, base form","verb, past participle",,,,,,,,,past perfect
134,I should have studied more for my test.,"verb, modal auxiliary","verb, base form","verb, past participle",,,,for,,,,,past perfect
135,I should have read the directions.,"verb, modal auxiliary","verb, base form","verb, past participle",,,,,,,,,past perfect
136,I should have eaten breakfast this morning.,"verb, modal auxiliary","verb, base form","verb, past participle",,,,this,,,,,past perfect
137,I should have listened to your advice.,"verb, modal auxiliary","verb, base form","verb, past participle",,,,,,,,,past perfect
138,I should have married her.,"verb, modal auxiliary","verb, base form","verb, past participle",,,,,,,,,past perfect
139,I shall leave tomorrow.,"verb, modal auxiliary","verb, base form",,,,,tomorrow,,,,,future simple
140,I shall finish the job next week.,"verb, modal auxiliary","verb, base form",,,,,next,week,,,,future simple
141,I shall see it tomorrow.,"verb, modal auxiliary","verb, base form",,,,,tomorrow,,,,,future simple
142,I shall go outside.,"verb, modal auxiliary","verb, base form",,,,,,,,,,future simple
143,I shall pay for this later.,"verb, modal auxiliary","verb, base form",,,,,for,this,,,,future simple
144,She could have gone to any college.,"verb, modal auxiliary","verb, base form","verb, past participle",,,,,,,,,past perfect
145,I would have gone to the party.,"verb, modal auxiliary","verb, base form","verb, past participle",,,,,,,,,past perfect
146,He should have told the truth.,"verb, modal auxiliary","verb, base form","verb, past participle",,,,,,,,,past perfect
147,I could have gone directly to college.,"verb, modal auxiliary","verb, base form","verb, past participle",,,,,,,,,past perfect
148,I would have loaned you the money.,"verb, modal auxiliary","verb, base form","verb, past participle",,,,,,,,,past perfect
149,I would have made a salad.,"verb, modal auxiliary","verb, base form","verb, past participle",,,,,,,,,past perfect
150,I would never know real love.,"verb, modal auxiliary","verb, base form",,,,,never,,,,,past perfect
151,My husband is singing.,"verb, 3rd person singular present","verb, gerund or present participle",,,,,,,,,,present progressive
152,I'm typing.,"verb, non-3rd person singular present","verb, gerund or present participle",,,,,,,,,,present progressive
153,Our friends are eating dinner at home tonight.,"verb, non-3rd person singular present","verb, gerund or present participle",,,,,,,,,,present progressive
154,I'm studying English..,"verb, non-3rd person singular present","verb, gerund or present participle",,,,,,,,,,present progressive
155,Our daughter is coming to visit us next Tuesday.,"verb, 3rd person singular present","verb, gerund or present participle","verb, base form",,,,next,,,,,future simple
156,Her bus leaves at 6:00 Tuesday morning.,"verb, 3rd person singular present",,,,,,,,,,,future simple
157,I’m turning in my History assignment tomorrow morning.,"verb, non-3rd person singular present","verb, gerund or present participle",,,,,tomorrow,,,,,future simple
158,"John will call her tomorrow, won’t he?","verb, modal auxiliary","verb, base form",,,,,tomorrow,,,,,future simple
159,"All those girls will be sitting quietly, won’t they?","verb, modal auxiliary","verb, base form","verb, gerund or present participle",,,,,,,,,future simple
160,"You’re coming over tonight, aren’t you?","verb, gerund or present participle","verb, non-3rd person singular present",,,,,,,,,,future simple
161,"That bee is going to sting me, isn’t it?","verb, 3rd person singular present","verb, gerund or present participle","verb, gerund or present participle","verb, 3rd person singular present",,,,,,,,future simple
162,"Carey won’t report me, will she?","verb, base form","verb, modal auxiliary",,,,,,,,,,future simple
163,"The kids aren’t going to play soccer tomorrow, are they?","verb, non-3rd person singular present","verb, gerund or present participle","verb, base form","verb, non-3rd person singular present",,,tomorrow,,,,,future simple
164,"You’re not working tomorrow, are you?","verb, non-3rd person singular present","verb, gerund or present participle","verb, non-3rd person singular present",,,,tomorrow,,,,,future simple
165,She’ll write the e-mail after lunch.,"verb, non-3rd person singular present",,,,,,,,,,,future simple
166,Don’t lift that. You’ll hurt yourself.,"verb, non-3rd person singular present","verb, base form","verb, non-3rd person singular present",,,,,,,,,future simple
167,You dropped your purse. I’ll get it.,"verb, past tense","verb, non-3rd person singular present",,,,,,,,,,future simple
168,I’ll see you tomorrow.,"verb, non-3rd person singular present",,,,,,tomorrow,,,,,future simple
169,You’ll get the answer by post.,"verb, non-3rd person singular present",,,,,,by,,,,,future simple
170,Dan’s going to take the order over to the customer.,"verb, gerund or present participle","verb, base form",,,,,,,,,,future simple
171,The girls are going to sing ‘Amazing Grace’ now.,"verb, non-3rd person singular present","verb, gerund or present participle","verb, base form",,,,now,,,,,future simple
172,I’ll drive you to your lesson at 4 pm.,"verb, non-3rd person singular present",,,,,,,,,,,future simple
173,He is going to clean up his room tonight.,"verb, 3rd person singular present","verb, gerund or present participle","verb, base form",,,,,,,,,future simple
174,Don’t phone me before 12:00. I will be meeting with a client.,"verb, non-3rd person singular present","verb, base form","verb, modal auxiliary","verb, base form","verb, gerund or present participle",,before,,,,,future simple
175,"This time next year, we will be living in our new home.","verb, modal auxiliary","verb, base form","verb, gerund or present participle",,,,time,next,year,,,future simple
176,He will be receiving his M.A. degree at the ceremony next week.,"verb, modal auxiliary","verb, base form","verb, gerund or present participle",,,,next,week,,,,future simple
177,Her bus leaves at 6:00 Tuesday morning.,"verb, 3rd person singular present",,,,,,,,,,,future simple
178,The sun sets in the west.,"verb, 3rd person singular present",,,,,,,,,,,present simple
179,We produce lasers for cosmetic surgery.,"verb, non-3rd person singular present",,,,,,for,,,,,present simple
180,They move into their new home next week.,"verb, non-3rd person singular present",,,,,,next,week,,,,present simple
181,"So, I go to Mr. D and say “I deserve a better mark in this class”.","verb, non-3rd person singular present","verb, base form","verb, non-3rd person singular present",,,,this,,,,,present simple
182,Jones stops in mid-court and passes the ball to Schuster.,"verb, 3rd person singular present","verb, 3rd person singular present",,,,,,,,,,present simple
183,I always study hard for exams.,"verb, non-3rd person singular present",,,,,,always,for,,,,present simple
184,Do you usually speak to him like that?,"verb, non-3rd person singular present","verb, base form",,,,,usually,,,,,present simple
185,Ben goes to football practice every Tuesday.,"verb, 3rd person singular present",,,,,,every,,,,,present simple
186,"In general, I believe that all people can live in peace.","verb, non-3rd person singular present","verb, modal auxiliary","verb, base form",,,,general,,,,,present simple
187,you go to the supermarket every week?,"verb, non-3rd person singular present",,,,,,every,week,,,,present simple
188,Generally I go to this pub.,"verb, non-3rd person singular present",,,,,,Generally,this,,,,present simple
189,Generally speaking he goes to work every weekday.,"verb, gerund or present participle","verb, 3rd person singular present",,,,,Generally,every,,,,present simple
